{
  "$schema": "../src/build/course.schema.json",
  "site": {
    "project": "heme-sap",
    "name": "Heme SAP Companion",
    "url": "https://heme-sap.pages.dev",
    "locale": "en",
    "ogLocale": "en_US",
    "brandIcon": "droplet",
    "title": "Heme SAP Companion — a video lecture for every section of ASH-SAP 9e",
    "description": "Every one of the 449 sections of the ASH-SAP 9th edition mapped to the lecture that explains it. Built for hematology fellows: society and journal sources, no med-student review videos. Search a section you did not follow, get the video.",
    "ogDescription": "449 ASH-SAP sections, each with the page number and the lecture that explains it. Fellowship level only — ASH, EHA, ESH, EBMT, VJHemOnc, journal and academic sources.",
    "keywords": [
      "hematology board review",
      "ASH-SAP",
      "hematology fellowship",
      "hematology self-assessment",
      "benign hematology",
      "hematologic malignancy",
      "hematology lectures"
    ],
    "audience": "Hematology fellows and hematologists preparing for board certification",
    "educationalLevel": "Postgraduate medical training (hematology fellowship)",
    "about": [
      "Hematology",
      "Board review",
      "Graduate medical education",
      "Hematologic malignancy"
    ],
    "learningResourceType": [
      "Video lecture index",
      "Board review companion",
      "Self-assessment"
    ]
  },
  "hero": {
    "eyebrow": "ASH-SAP 9e companion",
    "heading": "Every section of the book, mapped to the lecture that explains it",
    "lede": "Nine parts, 49 chapters, {units} sections of the ASH-SAP 9th edition. For each one you get <strong>the page it is on</strong>, <strong>a lecture that teaches it</strong>, and <strong>the trials the recommendation rests on</strong>. Pitched at fellows — society, journal and academic sources only."
  },
  "ui": {
    "searchPlaceholder": "Search a section, disease, drug or trial…",
    "tabs": {
      "course": "Sections",
      "player": "Watch",
      "stance": "What this is"
    },
    "progressLabel": "Progress",
    "facetLabel": "Filter by theme",
    "assessmentLabel": "Check yourself before moving on",
    "tightLabel": "High-yield",
    "weakLabel": "Common traps",
    "lessonLabel": "Core lecture",
    "drillEvidenceLabel": "Evidence behind this",
    "unitEvidenceLabel": "Evidence base",
    "stats": [
      {
        "icon": "book-open",
        "field": "lesson_units",
        "label": "book sections"
      },
      {
        "icon": "layers",
        "field": "video_unique",
        "label": "distinct videos"
      },
      {
        "icon": "clock",
        "field": "duration",
        "label": "total runtime"
      },
      {
        "icon": "graduation-cap",
        "field": "drill_units",
        "label": "supplementary videos"
      },
      {
        "icon": "microscope",
        "field": "evidence_checked",
        "label": "sections with cited evidence"
      }
    ],
    "unitTypes": {
      "section": "Book section",
      "concept": "Concept"
    },
    "problemType": "section",
    "evidenceRows": [
      {
        "field": "summary",
        "label": "Where the evidence stands"
      },
      {
        "field": "practice",
        "label": "What it changes in practice"
      },
      {
        "field": "red_flags",
        "label": "Do not miss",
        "type": "flags"
      },
      {
        "field": "caveats",
        "label": "Honest caveats"
      }
    ],
    "facetClear": "Clear theme filter",
    "facetPrefix": "Theme",
    "emptyTitle": "Nothing matches",
    "emptyHint": "Try another term, or clear the theme filter.",
    "playlistSearch": "Search the playlist…",
    "prevLabel": "Previous video",
    "nextLabel": "Next video",
    "doneLabel": "Done",
    "openExternal": "Open on YouTube",
    "moreLabel": "Why this video, and what to check",
    "discussLabel": "Discussion",
    "discussNote": "Comments are stored in this repository's GitHub Discussions and need a GitHub account. Each video has its own thread, shared across every section that uses it."
  },
  "kinds": [
    {
      "id": "mechanism",
      "label": "Mechanism",
      "tone": "accent"
    },
    {
      "id": "clinical",
      "label": "Clinical decision",
      "tone": "success"
    },
    {
      "id": "trial",
      "label": "Trial & guideline",
      "tone": "danger"
    }
  ],
  "grades": [
    {
      "id": "guideline",
      "label": "Guideline-backed",
      "tone": "success"
    },
    {
      "id": "trial",
      "label": "Randomized evidence",
      "tone": "accent"
    },
    {
      "id": "evolving",
      "label": "Evolving",
      "tone": "attention"
    },
    {
      "id": "contested",
      "label": "Contested",
      "tone": "danger"
    }
  ],
  "nav": [
    {
      "title": "Consultative hematology",
      "chapters": [
        "CH1",
        "CH2",
        "CH3",
        "CH4"
      ]
    },
    {
      "title": "Red cells and anemia",
      "chapters": [
        "CH5",
        "CH6",
        "CH7",
        "CH8",
        "CH9",
        "CH10",
        "CH11",
        "CH12",
        "CH13",
        "CH14"
      ]
    },
    {
      "title": "Thrombosis",
      "chapters": [
        "CH15",
        "CH16",
        "CH17",
        "CH18",
        "CH19"
      ]
    },
    {
      "title": "Bleeding disorders",
      "chapters": [
        "CH20",
        "CH21",
        "CH22"
      ]
    },
    {
      "title": "Platelet disorders",
      "chapters": [
        "CH23",
        "CH24",
        "CH25",
        "CH26"
      ]
    },
    {
      "title": "Laboratory and transfusion",
      "chapters": [
        "CH27",
        "CH28",
        "CH29"
      ]
    },
    {
      "title": "Transplantation and cellular therapy",
      "chapters": [
        "CH30",
        "CH31",
        "CH32",
        "CH33"
      ]
    },
    {
      "title": "Myeloid disorders",
      "chapters": [
        "CH34",
        "CH35",
        "CH36",
        "CH37",
        "CH38",
        "CH39",
        "CH40",
        "CH41"
      ]
    },
    {
      "title": "Lymphoid and plasma cell disorders",
      "chapters": [
        "CH42",
        "CH43",
        "CH44",
        "CH45",
        "CH46",
        "CH47",
        "CH48",
        "CH49"
      ]
    }
  ],
  "chapters": [
    {
      "code": "CH1",
      "title": "Consultative hematology 1: perioperative management concepts",
      "icon": "syringe",
      "source": "ch1",
      "units": 7,
      "drills": 17
    },
    {
      "code": "CH2",
      "title": "Consultative hematology 2: outpatient hematology topics",
      "icon": "stethoscope",
      "source": "ch2",
      "units": 7,
      "drills": 9
    },
    {
      "code": "CH3",
      "title": "Consultative hematology 3: women's health issues",
      "icon": "user-round",
      "source": "ch3",
      "units": 9,
      "drills": 26
    },
    {
      "code": "CH4",
      "title": "Pediatric hematology: selected topics",
      "icon": "baby",
      "source": "ch4",
      "units": 5,
      "drills": 8
    },
    {
      "code": "CH5",
      "title": "Hematopoietic growth factors",
      "icon": "sprout",
      "source": "ch5",
      "units": 7,
      "drills": 13
    },
    {
      "code": "CH6",
      "title": "Iron physiology, iron overload, and the porphyrias",
      "icon": "magnet",
      "source": "ch6",
      "units": 12,
      "drills": 18
    },
    {
      "code": "CH7",
      "title": "Acquired underproduction anemias: anemias in the setting of vitamin and mineral deficiencies",
      "icon": "apple",
      "source": "ch7",
      "units": 7,
      "drills": 11
    },
    {
      "code": "CH8",
      "title": "Anemia of inflammation",
      "icon": "flame",
      "source": "ch8",
      "units": 4,
      "drills": 3
    },
    {
      "code": "CH9",
      "title": "Anemia in the setting of organ insult, systemic disease, and aging",
      "icon": "heart-pulse",
      "source": "ch9",
      "units": 7,
      "drills": 12
    },
    {
      "code": "CH10",
      "title": "Thalassemia syndromes and other hemoglobinopathies",
      "icon": "dna",
      "source": "ch10",
      "units": 10,
      "drills": 17
    },
    {
      "code": "CH11",
      "title": "Sickle cell disease",
      "icon": "circle-dot",
      "source": "ch11",
      "units": 9,
      "drills": 18
    },
    {
      "code": "CH12",
      "title": "Hemolytic anemia 1: autoimmune hemolysis",
      "icon": "shield-alert",
      "source": "ch12",
      "units": 8,
      "drills": 6
    },
    {
      "code": "CH13",
      "title": "Hemolytic anemia 2: membrane abnormalities and enzymopathies",
      "icon": "hexagon",
      "source": "ch13",
      "units": 7,
      "drills": 4
    },
    {
      "code": "CH14",
      "title": "Complement-related disorders",
      "icon": "waves",
      "source": "ch14",
      "units": 9,
      "drills": 15
    },
    {
      "code": "CH15",
      "title": "Introduction to venous thromboembolism and antithrombotic drugs",
      "icon": "git-merge",
      "source": "ch15",
      "units": 10,
      "drills": 22
    },
    {
      "code": "CH16",
      "title": "Atypical-site thrombosis",
      "icon": "waypoints",
      "source": "ch16",
      "units": 11,
      "drills": 23
    },
    {
      "code": "CH17",
      "title": "Antiphospholipid syndrome",
      "icon": "spline",
      "source": "ch17",
      "units": 7,
      "drills": 15
    },
    {
      "code": "CH18",
      "title": "Cancer-associated thrombosis",
      "icon": "crosshair",
      "source": "ch18",
      "units": 10,
      "drills": 21
    },
    {
      "code": "CH19",
      "title": "Inherited thrombophilias",
      "icon": "git-fork",
      "source": "ch19",
      "units": 8,
      "drills": 15
    },
    {
      "code": "CH20",
      "title": "von Willebrand disease",
      "icon": "droplet",
      "source": "ch20",
      "units": 10,
      "drills": 23
    },
    {